Trial 456 finished with value: 0.7255308124423027 and parameters: {'lr': 0.0008069198405875567, 'batch_size': 93, 'n_epochs': 1625, 'early_stop': 141, 'n_neurons': 54, 'optimizer': 'Adam'}. Best is trial 290 with value: 0.7166826096177101.
Trial 457 finished with value: 0.7417029416561127 and parameters: {'lr': 0.0006936419493738357, 'batch_size': 89, 'n_epochs': 1630, 'early_stop': 119, 'n_neurons': 58, 'optimizer': 'Adam'}. Best is trial 290 with value: 0.7166826096177101.
Trial 458 finished with value: 0.7596291273832321 and parameters: {'lr': 0.0007910358946315011, 'batch_size': 185, 'n_epochs': 1496, 'early_stop': 366, 'n_neurons': 54, 'optimizer': 'Adam'}. Best is trial 290 with value: 0.7166826096177101.
Trial 459 finished with value: 0.7338533782958985 and parameters: {'lr': 0.000648577476037647, 'batch_size': 104, 'n_epochs': 1618, 'early_stop': 133, 'n_neurons': 56, 'optimizer': 'Adam'}. Best is trial 290 with value: 0.7166826096177101.
Trial 460 finished with value: 0.7423750311136246 and parameters: {'lr': 0.0007491319519091378, 'batch_size': 118, 'n_epochs': 1533, 'early_stop': 128, 'n_neurons': 54, 'optimizer': 'Adam'}. Best is trial 290 with value: 0.7166826096177101.
Trial 461 finished with value: 0.7549880170822143 and parameters: {'lr': 0.0008107575406968761, 'batch_size': 134, 'n_epochs': 1483, 'early_stop': 125, 'n_neurons': 135, 'optimizer': 'Adam'}. Best is trial 290 with value: 0.7166826096177101.
Trial 462 finished with value: 0.7411736398935318 and parameters: {'lr': 0.0007231740485287865, 'batch_size': 150, 'n_epochs': 1589, 'early_stop': 388, 'n_neurons': 58, 'optimizer': 'Adam'}. Best is trial 290 with value: 0.7166826096177101.
Trial 463 finished with value: 0.7299005758762359 and parameters: {'lr': 0.0008409325074455831, 'batch_size': 93, 'n_epochs': 1541, 'early_stop': 117, 'n_neurons': 53, 'optimizer': 'Adam'}. Best is trial 290 with value: 0.7166826096177101.
Trial 464 finished with value: 0.7348628252744674 and parameters: {'lr': 0.0007735853424426082, 'batch_size': 110, 'n_epochs': 1316, 'early_stop': 122, 'n_neurons': 56, 'optimizer': 'Adam'}. Best is trial 290 with value: 0.7166826096177101.
Trial 465 finished with value: 0.7378848722577095 and parameters: {'lr': 0.0008643473016097859, 'batch_size': 97, 'n_epochs': 1642, 'early_stop': 370, 'n_neurons': 52, 'optimizer': 'Adam'}. Best is trial 290 with value: 0.7166826096177101.
Trial 466 finished with value: 0.7366305413842201 and parameters: {'lr': 0.0006570575031436203, 'batch_size': 87, 'n_epochs': 1438, 'early_stop': 140, 'n_neurons': 54, 'optimizer': 'Adam'}. Best is trial 290 with value: 0.7166826096177101.
Trial 467 finished with value: 0.73766830265522 and parameters: {'lr': 0.0008750844501038809, 'batch_size': 90, 'n_epochs': 1399, 'early_stop': 111, 'n_neurons': 50, 'optimizer': 'Adam'}. Best is trial 290 with value: 0.7166826096177101.
Trial 468 finished with value: 0.7459098279476166 and parameters: {'lr': 0.000741881769083865, 'batch_size': 171, 'n_epochs': 1623, 'early_stop': 133, 'n_neurons': 52, 'optimizer': 'Adam'}. Best is trial 290 with value: 0.7166826096177101.
Trial 469 finished with value: 0.7353730994462967 and parameters: {'lr': 0.0009967110435213174, 'batch_size': 98, 'n_epochs': 1475, 'early_stop': 128, 'n_neurons': 55, 'optimizer': 'Adam'}. Best is trial 290 with value: 0.7166826096177101.
Trial 470 finished with value: 0.7680466416478157 and parameters: {'lr': 0.0008198218511523826, 'batch_size': 91, 'n_epochs': 1569, 'early_stop': 399, 'n_neurons': 254, 'optimizer': 'Adam'}. Best is trial 290 with value: 0.7166826096177101.
Trial 471 finished with value: 0.8793959474563598 and parameters: {'lr': 0.0009003180541526935, 'batch_size': 162, 'n_epochs': 1654, 'early_stop': 104, 'n_neurons': 60, 'optimizer': 'SGD'}. Best is trial 290 with value: 0.7166826096177101.
Trial 472 finished with value: 0.7601565164327622 and parameters: {'lr': 0.000696510427288058, 'batch_size': 102, 'n_epochs': 1545, 'early_stop': 349, 'n_neurons': 144, 'optimizer': 'Adam'}. Best is trial 290 with value: 0.7166826096177101.
Trial 473 finished with value: 0.7355575367808342 and parameters: {'lr': 0.0007881052416313118, 'batch_size': 95, 'n_epochs': 1371, 'early_stop': 122, 'n_neurons': 50, 'optimizer': 'Adam'}. Best is trial 290 with value: 0.7166826096177101.
Trial 474 finished with value: 0.7419934463500977 and parameters: {'lr': 0.0006269413374303628, 'batch_size': 86, 'n_epochs': 1620, 'early_stop': 114, 'n_neurons': 57, 'optimizer': 'Adam'}. Best is trial 290 with value: 0.7166826096177101.
Trial 475 finished with value: 0.7425797522068024 and parameters: {'lr': 0.0009194394745710193, 'batch_size': 115, 'n_epochs': 1210, 'early_stop': 379, 'n_neurons': 53, 'optimizer': 'Adam'}. Best is trial 290 with value: 0.7166826096177101.
Trial 476 finished with value: 0.738878253698349 and parameters: {'lr': 0.0008422529241312007, 'batch_size': 94, 'n_epochs': 1444, 'early_stop': 132, 'n_neurons': 52, 'optimizer': 'Adam'}. Best is trial 290 with value: 0.7166826096177101.
Trial 477 finished with value: 0.7331591886281967 and parameters: {'lr': 0.0007415141059925406, 'batch_size': 106, 'n_epochs': 1524, 'early_stop': 358, 'n_neurons': 55, 'optimizer': 'Adam'}. Best is trial 290 with value: 0.7166826096177101.
Trial 478 finished with value: 0.7378118461370469 and parameters: {'lr': 0.0008974637907800346, 'batch_size': 86, 'n_epochs': 1662, 'early_stop': 145, 'n_neurons': 123, 'optimizer': 'Adam'}. Best is trial 290 with value: 0.7166826096177101.
Trial 479 finished with value: 0.7433322072029114 and parameters: {'lr': 0.0006891172828245032, 'batch_size': 100, 'n_epochs': 1490, 'early_stop': 417, 'n_neurons': 50, 'optimizer': 'Adam'}. Best is trial 290 with value: 0.7166826096177101.
Trial 480 finished with value: 0.7240444198250771 and parameters: {'lr': 0.0008050836312041698, 'batch_size': 91, 'n_epochs': 1584, 'early_stop': 214, 'n_neurons': 52, 'optimizer': 'Adam'}. Best is trial 290 with value: 0.7166826096177101.
Trial 481 finished with value: 0.7348846167325973 and parameters: {'lr': 0.0007852355571501317, 'batch_size': 90, 'n_epochs': 1578, 'early_stop': 220, 'n_neurons': 51, 'optimizer': 'Adam'}. Best is trial 290 with value: 0.7166826096177101.
Trial 482 finished with value: 0.7405797001719475 and parameters: {'lr': 0.0008304486322590445, 'batch_size': 87, 'n_epochs': 1683, 'early_stop': 202, 'n_neurons': 54, 'optimizer': 'Adam'}. Best is trial 290 with value: 0.7166826096177101.
Trial 483 finished with value: 0.7511170315742492 and parameters: {'lr': 0.000998696015099878, 'batch_size': 199, 'n_epochs': 1602, 'early_stop': 211, 'n_neurons': 52, 'optimizer': 'Adam'}. Best is trial 290 with value: 0.7166826096177101.
Trial 484 finished with value: 0.730620766878128 and parameters: {'lr': 0.0007321640168268657, 'batch_size': 156, 'n_epochs': 1695, 'early_stop': 126, 'n_neurons': 50, 'optimizer': 'Adam'}. Best is trial 290 with value: 0.7166826096177101.
Trial 485 finished with value: 0.745481150150299 and parameters: {'lr': 0.0006536176785716587, 'batch_size': 92, 'n_epochs': 1555, 'early_stop': 119, 'n_neurons': 53, 'optimizer': 'Adam'}. Best is trial 290 with value: 0.7166826096177101.
Trial 486 finished with value: 0.7401124358177185 and parameters: {'lr': 0.0009123481858440005, 'batch_size': 84, 'n_epochs': 1641, 'early_stop': 210, 'n_neurons': 56, 'optimizer': 'Adam'}. Best is trial 290 with value: 0.7166826096177101.
Trial 487 finished with value: 0.7371935257315636 and parameters: {'lr': 0.0007787135501223538, 'batch_size': 91, 'n_epochs': 1684, 'early_stop': 128, 'n_neurons': 51, 'optimizer': 'Adam'}. Best is trial 290 with value: 0.7166826096177101.
Trial 488 finished with value: 0.7517101526260376 and parameters: {'lr': 0.0008373810406637366, 'batch_size': 95, 'n_epochs': 1578, 'early_stop': 196, 'n_neurons': 110, 'optimizer': 'Adam'}. Best is trial 290 with value: 0.7166826096177101.
Trial 489 finished with value: 0.7393188333511352 and parameters: {'lr': 0.0009112783444085331, 'batch_size': 88, 'n_epochs': 1269, 'early_stop': 136, 'n_neurons': 54, 'optimizer': 'Adam'}. Best is trial 290 with value: 0.7166826096177101.
Trial 490 finished with value: 0.9424999475479126 and parameters: {'lr': 0.000602995595237616, 'batch_size': 140, 'n_epochs': 1333, 'early_stop': 230, 'n_neurons': 52, 'optimizer': 'SGD'}. Best is trial 290 with value: 0.7166826096177101.
Trial 491 finished with value: 0.7305208727717399 and parameters: {'lr': 0.0007094683240854757, 'batch_size': 85, 'n_epochs': 1624, 'early_stop': 124, 'n_neurons': 50, 'optimizer': 'Adam'}. Best is trial 290 with value: 0.7166826096177101.
Trial 492 finished with value: 0.7379436063766479 and parameters: {'lr': 0.000997935071966171, 'batch_size': 97, 'n_epochs': 1545, 'early_stop': 131, 'n_neurons': 58, 'optimizer': 'Adam'}. Best is trial 290 with value: 0.7166826096177101.
Trial 493 finished with value: 0.7279916551709175 and parameters: {'lr': 0.0007785283605203346, 'batch_size': 93, 'n_epochs': 1692, 'early_stop': 117, 'n_neurons': 54, 'optimizer': 'Adam'}. Best is trial 290 with value: 0.7166826096177101.
Trial 494 finished with value: 0.7481154799461365 and parameters: {'lr': 0.0007748086977043888, 'batch_size': 213, 'n_epochs': 1599, 'early_stop': 113, 'n_neurons': 57, 'optimizer': 'Adam'}. Best is trial 290 with value: 0.7166826096177101.
Trial 495 finished with value: 0.7378399363160133 and parameters: {'lr': 0.0006767544653480708, 'batch_size': 89, 'n_epochs': 1690, 'early_stop': 116, 'n_neurons': 55, 'optimizer': 'Adam'}. Best is trial 290 with value: 0.7166826096177101.
Trial 496 finished with value: 0.7414979040622711 and parameters: {'lr': 0.0008574512634225356, 'batch_size': 175, 'n_epochs': 1508, 'early_stop': 106, 'n_neurons': 59, 'optimizer': 'Adam'}. Best is trial 290 with value: 0.7166826096177101.
Trial 497 finished with value: 0.7312710922956467 and parameters: {'lr': 0.0007300656333697735, 'batch_size': 91, 'n_epochs': 1641, 'early_stop': 117, 'n_neurons': 54, 'optimizer': 'Adam'}. Best is trial 290 with value: 0.7166826096177101.
Trial 498 finished with value: 0.7293642926216125 and parameters: {'lr': 0.0009308911454855478, 'batch_size': 84, 'n_epochs': 1451, 'early_stop': 111, 'n_neurons': 61, 'optimizer': 'Adam'}. Best is trial 290 with value: 0.7166826096177101.
Trial 499 finished with value: 0.7493652892112732 and parameters: {'lr': 0.0008602170718363027, 'batch_size': 93, 'n_epochs': 1610, 'early_stop': 127, 'n_neurons': 55, 'optimizer': 'Adam'}. Best is trial 290 with value: 0.7166826096177101.
Trial 500 finished with value: 0.7383909153938294 and parameters: {'lr': 0.00021873372623022592, 'batch_size': 88, 'n_epochs': 1546, 'early_stop': 117, 'n_neurons': 53, 'optimizer': 'Adam'}. Best is trial 290 with value: 0.7166826096177101.
Trial 501 finished with value: 0.7388582497835159 and parameters: {'lr': 0.0007676046712564288, 'batch_size': 95, 'n_epochs': 1719, 'early_stop': 122, 'n_neurons': 56, 'optimizer': 'Adam'}. Best is trial 290 with value: 0.7166826096177101.
Trial 502 finished with value: 0.7577171421051025 and parameters: {'lr': 0.0006151948953070133, 'batch_size': 192, 'n_epochs': 1404, 'early_stop': 121, 'n_neurons': 52, 'optimizer': 'Adam'}. Best is trial 290 with value: 0.7166826096177101.
Trial 503 finished with value: 0.7272437214851379 and parameters: {'lr': 0.0008113877645743458, 'batch_size': 84, 'n_epochs': 1667, 'early_stop': 120, 'n_neurons': 57, 'optimizer': 'Adam'}. Best is trial 290 with value: 0.7166826096177101.
Trial 504 finished with value: 0.7673584115505219 and parameters: {'lr': 0.0006716944882988306, 'batch_size': 84, 'n_epochs': 1696, 'early_stop': 114, 'n_neurons': 60, 'optimizer': 'Adam'}. Best is trial 290 with value: 0.7166826096177101.
Trial 505 finished with value: 0.7266912952065467 and parameters: {'lr': 0.0007873713476850196, 'batch_size': 83, 'n_epochs': 1325, 'early_stop': 224, 'n_neurons': 57, 'optimizer': 'Adam'}. Best is trial 290 with value: 0.7166826096177101.
Trial 506 finished with value: 0.7627267327904701 and parameters: {'lr': 0.0007994580222949034, 'batch_size': 41, 'n_epochs': 1274, 'early_stop': 210, 'n_neurons': 61, 'optimizer': 'Adam'}. Best is trial 290 with value: 0.7166826096177101.
Trial 507 finished with value: 0.7334364035725593 and parameters: {'lr': 0.0008236936657023959, 'batch_size': 83, 'n_epochs': 1338, 'early_stop': 223, 'n_neurons': 58, 'optimizer': 'Adam'}. Best is trial 290 with value: 0.7166826096177101.
Trial 508 finished with value: 0.7368552666902543 and parameters: {'lr': 0.00075816784790062, 'batch_size': 87, 'n_epochs': 1192, 'early_stop': 216, 'n_neurons': 62, 'optimizer': 'Adam'}. Best is trial 290 with value: 0.7166826096177101.
Trial 509 finished with value: 0.7323635578155517 and parameters: {'lr': 0.0008481616627959109, 'batch_size': 84, 'n_epochs': 1324, 'early_stop': 238, 'n_neurons': 58, 'optimizer': 'Adam'}. Best is trial 290 with value: 0.7166826096177101.
Trial 510 finished with value: 0.7348047941923141 and parameters: {'lr': 0.000929155015903271, 'batch_size': 87, 'n_epochs': 1161, 'early_stop': 119, 'n_neurons': 57, 'optimizer': 'Adam'}. Best is trial 290 with value: 0.7166826096177101.
Trial 511 finished with value: 0.9745579379796981 and parameters: {'lr': 0.0007371241446098517, 'batch_size': 82, 'n_epochs': 1116, 'early_stop': 110, 'n_neurons': 59, 'optimizer': 'SGD'}. Best is trial 290 with value: 0.7166826096177101.
Trial 512 finished with value: 0.7328671944141388 and parameters: {'lr': 0.0008457254175497002, 'batch_size': 146, 'n_epochs': 1694, 'early_stop': 229, 'n_neurons': 56, 'optimizer': 'Adam'}. Best is trial 290 with value: 0.7166826096177101.
Trial 513 finished with value: 0.730575653910637 and parameters: {'lr': 0.000765345018250219, 'batch_size': 90, 'n_epochs': 1238, 'early_stop': 120, 'n_neurons': 56, 'optimizer': 'Adam'}. Best is trial 290 with value: 0.7166826096177101.
Trial 514 finished with value: 0.7595312169194222 and parameters: {'lr': 0.0006775488980819189, 'batch_size': 153, 'n_epochs': 1307, 'early_stop': 204, 'n_neurons': 128, 'optimizer': 'Adam'}. Best is trial 290 with value: 0.7166826096177101.
Trial 515 finished with value: 0.7553438109159469 and parameters: {'lr': 0.000938619420581593, 'batch_size': 179, 'n_epochs': 1391, 'early_stop': 102, 'n_neurons': 54, 'optimizer': 'Adam'}. Best is trial 290 with value: 0.7166826096177101.
Trial 516 finished with value: 0.7375819587707519 and parameters: {'lr': 0.0009965999633132572, 'batch_size': 88, 'n_epochs': 1268, 'early_stop': 340, 'n_neurons': 90, 'optimizer': 'Adam'}. Best is trial 290 with value: 0.7166826096177101.
Trial 517 finished with value: 0.7459343177080154 and parameters: {'lr': 0.0008541163919829602, 'batch_size': 162, 'n_epochs': 1373, 'early_stop': 114, 'n_neurons': 58, 'optimizer': 'Adam'}. Best is trial 290 with value: 0.7166826096177101.
Trial 518 finished with value: 0.7533663511276245 and parameters: {'lr': 0.0007964616991387506, 'batch_size': 84, 'n_epochs': 1732, 'early_stop': 141, 'n_neurons': 105, 'optimizer': 'Adam'}. Best is trial 290 with value: 0.7166826096177101.
Trial 519 finished with value: 0.7370021736621857 and parameters: {'lr': 0.0007156683542981059, 'batch_size': 91, 'n_epochs': 3196, 'early_stop': 324, 'n_neurons': 52, 'optimizer': 'Adam'}. Best is trial 290 with value: 0.7166826096177101.
Trial 520 finished with value: 0.7420404827594758 and parameters: {'lr': 0.0008998276536067967, 'batch_size': 169, 'n_epochs': 1663, 'early_stop': 136, 'n_neurons': 55, 'optimizer': 'Adam'}. Best is trial 290 with value: 0.7166826096177101.
Trial 521 finished with value: 0.7485545459389686 and parameters: {'lr': 0.0007979470364056605, 'batch_size': 81, 'n_epochs': 1751, 'early_stop': 123, 'n_neurons': 53, 'optimizer': 'Adam'}. Best is trial 290 with value: 0.7166826096177101.
Trial 522 finished with value: 0.7343157124519348 and parameters: {'lr': 0.0009989069307885002, 'batch_size': 88, 'n_epochs': 1348, 'early_stop': 131, 'n_neurons': 50, 'optimizer': 'Adam'}. Best is trial 290 with value: 0.7166826096177101.
Trial 523 finished with value: 0.738399863243103 and parameters: {'lr': 0.0006132820428400948, 'batch_size': 85, 'n_epochs': 1428, 'early_stop': 244, 'n_neurons': 60, 'optimizer': 'Adam'}. Best is trial 290 with value: 0.7166826096177101.
Trial 524 finished with value: 0.7393872737884521 and parameters: {'lr': 0.0008716457037444054, 'batch_size': 92, 'n_epochs': 1643, 'early_stop': 147, 'n_neurons': 57, 'optimizer': 'Adam'}. Best is trial 290 with value: 0.7166826096177101.
Trial 525 finished with value: 0.7633561658859253 and parameters: {'lr': 0.0007590734920738586, 'batch_size': 98, 'n_epochs': 1482, 'early_stop': 119, 'n_neurons': 159, 'optimizer': 'Adam'}. Best is trial 290 with value: 0.7166826096177101.
Trial 526 finished with value: 0.8287241065502167 and parameters: {'lr': 0.00017887279303094715, 'batch_size': 92, 'n_epochs': 1602, 'early_stop': 345, 'n_neurons': 233, 'optimizer': 'Adam'}. Best is trial 290 with value: 0.7166826096177101.
Trial 527 finished with value: 0.7375634610652924 and parameters: {'lr': 0.0007002123191898313, 'batch_size': 86, 'n_epochs': 1719, 'early_stop': 363, 'n_neurons': 52, 'optimizer': 'Adam'}. Best is trial 290 with value: 0.7166826096177101.
Trial 528 finished with value: 0.7450533246994019 and parameters: {'lr': 0.0008795086757152836, 'batch_size': 96, 'n_epochs': 2784, 'early_stop': 125, 'n_neurons': 54, 'optimizer': 'Adam'}. Best is trial 290 with value: 0.7166826096177101.
Trial 529 finished with value: 0.903737713098526 and parameters: {'lr': 0.0008199055312197737, 'batch_size': 187, 'n_epochs': 1656, 'early_stop': 223, 'n_neurons': 56, 'optimizer': 'SGD'}. Best is trial 290 with value: 0.7166826096177101.
Trial 530 finished with value: 0.7385215759277344 and parameters: {'lr': 0.000923244485243479, 'batch_size': 80, 'n_epochs': 2413, 'early_stop': 318, 'n_neurons': 51, 'optimizer': 'Adam'}. Best is trial 290 with value: 0.7166826096177101.
Trial 531 finished with value: 0.7384028080105781 and parameters: {'lr': 0.0006420197737312173, 'batch_size': 89, 'n_epochs': 1291, 'early_stop': 130, 'n_neurons': 53, 'optimizer': 'Adam'}. Best is trial 290 with value: 0.7166826096177101.
Trial 532 finished with value: 0.7427500891685486 and parameters: {'lr': 0.000773095127048937, 'batch_size': 166, 'n_epochs': 1493, 'early_stop': 335, 'n_neurons': 50, 'optimizer': 'Adam'}. Best is trial 290 with value: 0.7166826096177101.
Trial 533 finished with value: 0.7409020429849624 and parameters: {'lr': 0.0009218974962769995, 'batch_size': 82, 'n_epochs': 1365, 'early_stop': 115, 'n_neurons': 54, 'optimizer': 'Adam'}. Best is trial 290 with value: 0.7166826096177101.
Trial 534 finished with value: 0.7318019026517868 and parameters: {'lr': 0.000717479786526392, 'batch_size': 93, 'n_epochs': 1578, 'early_stop': 310, 'n_neurons': 52, 'optimizer': 'Adam'}. Best is trial 290 with value: 0.7166826096177101.
Trial 535 finished with value: 0.7556231170892715 and parameters: {'lr': 0.000574777739362642, 'batch_size': 157, 'n_epochs': 1768, 'early_stop': 235, 'n_neurons': 56, 'optimizer': 'Adam'}. Best is trial 290 with value: 0.7166826096177101.
Trial 536 finished with value: 0.7550880253314972 and parameters: {'lr': 0.0008250060311257577, 'batch_size': 130, 'n_epochs': 1425, 'early_stop': 217, 'n_neurons': 50, 'optimizer': 'Adam'}. Best is trial 290 with value: 0.7166826096177101.
Trial 537 finished with value: 0.7368220195174218 and parameters: {'lr': 0.0009949227518605142, 'batch_size': 85, 'n_epochs': 1660, 'early_stop': 201, 'n_neurons': 58, 'optimizer': 'Adam'}. Best is trial 290 with value: 0.7166826096177101.
Trial 538 finished with value: 0.7286108595132827 and parameters: {'lr': 0.0008700330133659464, 'batch_size': 101, 'n_epochs': 1532, 'early_stop': 120, 'n_neurons': 52, 'optimizer': 'Adam'}. Best is trial 290 with value: 0.7166826096177101.
Trial 539 finished with value: 0.738167170882225 and parameters: {'lr': 0.0006659834538404419, 'batch_size': 102, 'n_epochs': 1510, 'early_stop': 123, 'n_neurons': 51, 'optimizer': 'Adam'}. Best is trial 290 with value: 0.7166826096177101.
Trial 540 finished with value: 0.735804557800293 and parameters: {'lr': 0.0007492555622684315, 'batch_size': 100, 'n_epochs': 1542, 'early_stop': 118, 'n_neurons': 55, 'optimizer': 'Adam'}. Best is trial 290 with value: 0.7166826096177101.
Trial 541 finished with value: 0.7404891806840896 and parameters: {'lr': 0.0008143912773069115, 'batch_size': 103, 'n_epochs': 1467, 'early_stop': 112, 'n_neurons': 52, 'optimizer': 'Adam'}. Best is trial 290 with value: 0.7166826096177101.
Trial 542 finished with value: 0.728754463493824 and parameters: {'lr': 0.0007143865232091198, 'batch_size': 97, 'n_epochs': 1600, 'early_stop': 117, 'n_neurons': 50, 'optimizer': 'Adam'}. Best is trial 290 with value: 0.7166826096177101.
Trial 543 finished with value: 0.7367594718933106 and parameters: {'lr': 0.0008578389642506772, 'batch_size': 96, 'n_epochs': 2887, 'early_stop': 121, 'n_neurons': 53, 'optimizer': 'Adam'}. Best is trial 290 with value: 0.7166826096177101.
Trial 544 finished with value: 0.7587179774045945 and parameters: {'lr': 0.0007980647847899895, 'batch_size': 101, 'n_epochs': 1524, 'early_stop': 127, 'n_neurons': 116, 'optimizer': 'Adam'}. Best is trial 290 with value: 0.7166826096177101.
Trial 545 finished with value: 0.771352173089981 and parameters: {'lr': 0.0006376121490997437, 'batch_size': 94, 'n_epochs': 1438, 'early_stop': 124, 'n_neurons': 213, 'optimizer': 'Adam'}. Best is trial 290 with value: 0.7166826096177101.
Trial 546 finished with value: 0.7375026267766952 and parameters: {'lr': 0.0008623978298704599, 'batch_size': 106, 'n_epochs': 1589, 'early_stop': 120, 'n_neurons': 54, 'optimizer': 'Adam'}. Best is trial 290 with value: 0.7166826096177101.
