Trial 729 finished with value: 0.7472123366594314 and parameters: {'lr': 0.0008116950071727931, 'batch_size': 142, 'n_epochs': 1545, 'early_stop': 313, 'n_neurons': 50, 'optimizer': 'Adam'}. Best is trial 290 with value: 0.7166826096177101.
Trial 730 finished with value: 0.7378050994873047 and parameters: {'lr': 0.0006340398462408442, 'batch_size': 168, 'n_epochs': 4801, 'early_stop': 303, 'n_neurons': 56, 'optimizer': 'Adam'}. Best is trial 290 with value: 0.7166826096177101.
Trial 731 finished with value: 0.7524872881174087 and parameters: {'lr': 0.0007284398488636013, 'batch_size': 191, 'n_epochs': 1821, 'early_stop': 320, 'n_neurons': 52, 'optimizer': 'Adam'}. Best is trial 290 with value: 0.7166826096177101.
Trial 732 finished with value: 0.7284471797943115 and parameters: {'lr': 0.0005542407148267643, 'batch_size': 82, 'n_epochs': 1724, 'early_stop': 338, 'n_neurons': 52, 'optimizer': 'Adam'}. Best is trial 290 with value: 0.7166826096177101.
Trial 733 finished with value: 0.7387851595878601 and parameters: {'lr': 0.0008591876462936398, 'batch_size': 88, 'n_epochs': 3852, 'early_stop': 349, 'n_neurons': 54, 'optimizer': 'Adam'}. Best is trial 290 with value: 0.7166826096177101.
Trial 734 finished with value: 0.7354385030269622 and parameters: {'lr': 0.0006953037917783734, 'batch_size': 134, 'n_epochs': 1600, 'early_stop': 363, 'n_neurons': 50, 'optimizer': 'Adam'}. Best is trial 290 with value: 0.7166826096177101.
Trial 735 finished with value: 0.7368121147155762 and parameters: {'lr': 0.0007996600206296632, 'batch_size': 215, 'n_epochs': 4367, 'early_stop': 296, 'n_neurons': 52, 'optimizer': 'Adam'}. Best is trial 290 with value: 0.7166826096177101.
Trial 736 finished with value: 0.7586986422538757 and parameters: {'lr': 0.00041586981336232424, 'batch_size': 201, 'n_epochs': 1667, 'early_stop': 329, 'n_neurons': 129, 'optimizer': 'Adam'}. Best is trial 290 with value: 0.7166826096177101.
Trial 737 finished with value: 0.7335989266633988 and parameters: {'lr': 0.0004849964599171213, 'batch_size': 162, 'n_epochs': 2791, 'early_stop': 314, 'n_neurons': 56, 'optimizer': 'Adam'}. Best is trial 290 with value: 0.7166826096177101.
Trial 738 finished with value: 0.7317875695228576 and parameters: {'lr': 0.0009145240828172347, 'batch_size': 86, 'n_epochs': 1533, 'early_stop': 163, 'n_neurons': 50, 'optimizer': 'Adam'}. Best is trial 290 with value: 0.7166826096177101.
Trial 739 finished with value: 0.7423649409413338 and parameters: {'lr': 0.0005882569752917757, 'batch_size': 151, 'n_epochs': 2556, 'early_stop': 304, 'n_neurons': 54, 'optimizer': 'Adam'}. Best is trial 290 with value: 0.7166826096177101.
Trial 740 finished with value: 0.7340531092882157 and parameters: {'lr': 0.0006429289490489613, 'batch_size': 178, 'n_epochs': 2679, 'early_stop': 284, 'n_neurons': 52, 'optimizer': 'Adam'}. Best is trial 290 with value: 0.7166826096177101.
Trial 741 finished with value: 0.9217125999927521 and parameters: {'lr': 0.0007591046866574797, 'batch_size': 129, 'n_epochs': 3521, 'early_stop': 328, 'n_neurons': 57, 'optimizer': 'SGD'}. Best is trial 290 with value: 0.7166826096177101.
Trial 742 finished with value: 0.7347266563773155 and parameters: {'lr': 0.0008665202829397972, 'batch_size': 89, 'n_epochs': 1656, 'early_stop': 394, 'n_neurons': 53, 'optimizer': 'Adam'}. Best is trial 290 with value: 0.7166826096177101.
Trial 743 finished with value: 0.7388981997966766 and parameters: {'lr': 0.0006884867496865069, 'batch_size': 56, 'n_epochs': 1768, 'early_stop': 191, 'n_neurons': 50, 'optimizer': 'Adam'}. Best is trial 290 with value: 0.7166826096177101.
Trial 744 finished with value: 0.7289503133296966 and parameters: {'lr': 0.0009296107055779324, 'batch_size': 111, 'n_epochs': 1604, 'early_stop': 208, 'n_neurons': 55, 'optimizer': 'Adam'}. Best is trial 290 with value: 0.7166826096177101.
Trial 745 finished with value: 0.7398708462715149 and parameters: {'lr': 0.0008042117332897159, 'batch_size': 98, 'n_epochs': 1564, 'early_stop': 294, 'n_neurons': 51, 'optimizer': 'Adam'}. Best is trial 290 with value: 0.7166826096177101.
Trial 746 finished with value: 0.7368979611992836 and parameters: {'lr': 0.0007116533684627743, 'batch_size': 191, 'n_epochs': 2742, 'early_stop': 310, 'n_neurons': 53, 'optimizer': 'Adam'}. Best is trial 290 with value: 0.7166826096177101.
Trial 747 finished with value: 0.7251728281378746 and parameters: {'lr': 0.0006214111885523255, 'batch_size': 85, 'n_epochs': 2469, 'early_stop': 320, 'n_neurons': 51, 'optimizer': 'Adam'}. Best is trial 290 with value: 0.7166826096177101.
Trial 748 finished with value: 0.7248621916770935 and parameters: {'lr': 0.0005480268041693746, 'batch_size': 81, 'n_epochs': 2383, 'early_stop': 343, 'n_neurons': 50, 'optimizer': 'Adam'}. Best is trial 290 with value: 0.7166826096177101.
Trial 749 finished with value: 0.7377296447753906 and parameters: {'lr': 0.000523886197564469, 'batch_size': 80, 'n_epochs': 1158, 'early_stop': 348, 'n_neurons': 50, 'optimizer': 'Adam'}. Best is trial 290 with value: 0.7166826096177101.
Trial 750 finished with value: 0.7432693019509315 and parameters: {'lr': 0.0005418425590741704, 'batch_size': 77, 'n_epochs': 2368, 'early_stop': 339, 'n_neurons': 51, 'optimizer': 'Adam'}. Best is trial 290 with value: 0.7166826096177101.
Trial 751 finished with value: 0.7411464160680771 and parameters: {'lr': 0.0004821053323774622, 'batch_size': 83, 'n_epochs': 2312, 'early_stop': 103, 'n_neurons': 52, 'optimizer': 'Adam'}. Best is trial 290 with value: 0.7166826096177101.
Trial 752 finished with value: 0.739427713751793 and parameters: {'lr': 0.000570377475065461, 'batch_size': 78, 'n_epochs': 2435, 'early_stop': 358, 'n_neurons': 50, 'optimizer': 'Adam'}. Best is trial 290 with value: 0.7166826096177101.
Trial 753 finished with value: 0.7329041260480881 and parameters: {'lr': 0.000528216940492067, 'batch_size': 81, 'n_epochs': 2260, 'early_stop': 370, 'n_neurons': 52, 'optimizer': 'Adam'}. Best is trial 290 with value: 0.7166826096177101.
Trial 754 finished with value: 0.7354212886095047 and parameters: {'lr': 0.0005951516160865829, 'batch_size': 83, 'n_epochs': 2335, 'early_stop': 150, 'n_neurons': 50, 'optimizer': 'Adam'}. Best is trial 290 with value: 0.7166826096177101.
Trial 755 finished with value: 0.7448895823955536 and parameters: {'lr': 0.0004446554701783297, 'batch_size': 76, 'n_epochs': 1797, 'early_stop': 340, 'n_neurons': 52, 'optimizer': 'Adam'}. Best is trial 290 with value: 0.7166826096177101.
Trial 756 finished with value: 0.734168277978897 and parameters: {'lr': 0.0004647092270076163, 'batch_size': 82, 'n_epochs': 2437, 'early_stop': 346, 'n_neurons': 54, 'optimizer': 'Adam'}. Best is trial 290 with value: 0.7166826096177101.
Trial 757 finished with value: 0.7363843318819999 and parameters: {'lr': 0.0005752898254441841, 'batch_size': 79, 'n_epochs': 2480, 'early_stop': 378, 'n_neurons': 52, 'optimizer': 'Adam'}. Best is trial 290 with value: 0.7166826096177101.
Trial 758 finished with value: 0.7329806074500084 and parameters: {'lr': 0.0004993863866114488, 'batch_size': 85, 'n_epochs': 1088, 'early_stop': 332, 'n_neurons': 50, 'optimizer': 'Adam'}. Best is trial 290 with value: 0.7166826096177101.
Trial 759 finished with value: 0.7374697181582451 and parameters: {'lr': 0.0005664516134394416, 'batch_size': 77, 'n_epochs': 2493, 'early_stop': 100, 'n_neurons': 53, 'optimizer': 'Adam'}. Best is trial 290 with value: 0.7166826096177101.
Trial 760 finished with value: 0.7241108804941178 and parameters: {'lr': 0.0006203281127213289, 'batch_size': 85, 'n_epochs': 3004, 'early_stop': 322, 'n_neurons': 51, 'optimizer': 'Adam'}. Best is trial 290 with value: 0.7166826096177101.
Trial 761 finished with value: 0.7317434877157212 and parameters: {'lr': 0.0005205424712525392, 'batch_size': 85, 'n_epochs': 2876, 'early_stop': 324, 'n_neurons': 50, 'optimizer': 'Adam'}. Best is trial 290 with value: 0.7166826096177101.
Trial 762 finished with value: 0.734955502152443 and parameters: {'lr': 0.0006074036301787334, 'batch_size': 86, 'n_epochs': 3401, 'early_stop': 321, 'n_neurons': 51, 'optimizer': 'Adam'}. Best is trial 290 with value: 0.7166826096177101.
Trial 763 finished with value: 0.7530253916978836 and parameters: {'lr': 0.0006229775429677591, 'batch_size': 52, 'n_epochs': 3140, 'early_stop': 353, 'n_neurons': 52, 'optimizer': 'Adam'}. Best is trial 290 with value: 0.7166826096177101.
Trial 764 finished with value: 1.0485203385353088 and parameters: {'lr': 0.0004953275635534828, 'batch_size': 185, 'n_epochs': 3086, 'early_stop': 334, 'n_neurons': 50, 'optimizer': 'SGD'}. Best is trial 290 with value: 0.7166826096177101.
Trial 765 finished with value: 0.7379221802949906 and parameters: {'lr': 0.0005417168298094457, 'batch_size': 86, 'n_epochs': 2857, 'early_stop': 325, 'n_neurons': 52, 'optimizer': 'Adam'}. Best is trial 290 with value: 0.7166826096177101.
Trial 766 finished with value: 0.7347998893260956 and parameters: {'lr': 0.0006220918718701438, 'batch_size': 81, 'n_epochs': 3296, 'early_stop': 339, 'n_neurons': 50, 'optimizer': 'Adam'}. Best is trial 290 with value: 0.7166826096177101.
Trial 767 finished with value: 0.7514483511447907 and parameters: {'lr': 0.00040497351506418373, 'batch_size': 177, 'n_epochs': 2999, 'early_stop': 319, 'n_neurons': 53, 'optimizer': 'Adam'}. Best is trial 290 with value: 0.7166826096177101.
Trial 768 finished with value: 0.7475321769714356 and parameters: {'lr': 0.0005613710187075269, 'batch_size': 88, 'n_epochs': 2728, 'early_stop': 347, 'n_neurons': 51, 'optimizer': 'Adam'}. Best is trial 290 with value: 0.7166826096177101.
Trial 769 finished with value: 0.8091200959682464 and parameters: {'lr': 0.0006271173053281293, 'batch_size': 166, 'n_epochs': 2606, 'early_stop': 362, 'n_neurons': 276, 'optimizer': 'Adam'}. Best is trial 290 with value: 0.7166826096177101.
Trial 770 finished with value: 0.7332728442549705 and parameters: {'lr': 0.00048417874168782003, 'batch_size': 83, 'n_epochs': 2932, 'early_stop': 311, 'n_neurons': 54, 'optimizer': 'Adam'}. Best is trial 290 with value: 0.7166826096177101.
Trial 771 finished with value: 0.7551305890083313 and parameters: {'lr': 0.0005766997174619858, 'batch_size': 202, 'n_epochs': 3216, 'early_stop': 332, 'n_neurons': 52, 'optimizer': 'Adam'}. Best is trial 290 with value: 0.7166826096177101.
Trial 772 finished with value: 0.744232049882412 and parameters: {'lr': 0.0006234369057853049, 'batch_size': 159, 'n_epochs': 3097, 'early_stop': 321, 'n_neurons': 50, 'optimizer': 'Adam'}. Best is trial 290 with value: 0.7166826096177101.
Trial 773 finished with value: 0.732541384100914 and parameters: {'lr': 0.000646998692378275, 'batch_size': 91, 'n_epochs': 3675, 'early_stop': 304, 'n_neurons': 54, 'optimizer': 'Adam'}. Best is trial 290 with value: 0.7166826096177101.
Trial 774 finished with value: 0.752553240954876 and parameters: {'lr': 0.0005841336307871449, 'batch_size': 185, 'n_epochs': 3002, 'early_stop': 334, 'n_neurons': 52, 'optimizer': 'Adam'}. Best is trial 290 with value: 0.7166826096177101.
Trial 775 finished with value: 0.757422924041748 and parameters: {'lr': 0.0004342496841199089, 'batch_size': 216, 'n_epochs': 2777, 'early_stop': 319, 'n_neurons': 74, 'optimizer': 'Adam'}. Best is trial 290 with value: 0.7166826096177101.
Trial 776 finished with value: 0.7497826689481735 and parameters: {'lr': 0.0005442153399346889, 'batch_size': 78, 'n_epochs': 1862, 'early_stop': 349, 'n_neurons': 69, 'optimizer': 'Adam'}. Best is trial 290 with value: 0.7166826096177101.
Trial 777 finished with value: 0.7299338191747665 and parameters: {'lr': 0.0006568193477684313, 'batch_size': 74, 'n_epochs': 2694, 'early_stop': 310, 'n_neurons': 50, 'optimizer': 'Adam'}. Best is trial 290 with value: 0.7166826096177101.
Trial 778 finished with value: 0.7907729417085647 and parameters: {'lr': 8.126060776664035e-05, 'batch_size': 170, 'n_epochs': 2599, 'early_stop': 301, 'n_neurons': 53, 'optimizer': 'Adam'}. Best is trial 290 with value: 0.7166826096177101.
Trial 779 finished with value: 0.7389603170752526 and parameters: {'lr': 0.0005127397202082239, 'batch_size': 89, 'n_epochs': 2837, 'early_stop': 156, 'n_neurons': 51, 'optimizer': 'Adam'}. Best is trial 290 with value: 0.7166826096177101.
Trial 780 finished with value: 0.9361410722136497 and parameters: {'lr': 0.0006442428750796067, 'batch_size': 145, 'n_epochs': 3584, 'early_stop': 327, 'n_neurons': 55, 'optimizer': 'SGD'}. Best is trial 290 with value: 0.7166826096177101.
Trial 781 finished with value: 9.283172607421875 and parameters: {'lr': 2.931397144644196e-05, 'batch_size': 231, 'n_epochs': 2520, 'early_stop': 365, 'n_neurons': 52, 'optimizer': 'Adam'}. Best is trial 290 with value: 0.7166826096177101.
Trial 782 finished with value: 0.7360155397653579 and parameters: {'lr': 0.0006767415466820304, 'batch_size': 82, 'n_epochs': 2405, 'early_stop': 342, 'n_neurons': 50, 'optimizer': 'Adam'}. Best is trial 290 with value: 0.7166826096177101.
Trial 783 finished with value: 0.7584755915403366 and parameters: {'lr': 0.0005948539712316094, 'batch_size': 198, 'n_epochs': 1739, 'early_stop': 312, 'n_neurons': 54, 'optimizer': 'Adam'}. Best is trial 290 with value: 0.7166826096177101.
Trial 784 finished with value: 0.7461112976074219 and parameters: {'lr': 0.00048063058785589126, 'batch_size': 191, 'n_epochs': 2681, 'early_stop': 299, 'n_neurons': 52, 'optimizer': 'Adam'}. Best is trial 290 with value: 0.7166826096177101.
Trial 785 finished with value: 0.7304076302051544 and parameters: {'lr': 0.0007020892049421223, 'batch_size': 86, 'n_epochs': 1727, 'early_stop': 288, 'n_neurons': 50, 'optimizer': 'Adam'}. Best is trial 290 with value: 0.7166826096177101.
Trial 786 finished with value: 0.7681982177495956 and parameters: {'lr': 0.0005414647930702918, 'batch_size': 38, 'n_epochs': 1828, 'early_stop': 326, 'n_neurons': 54, 'optimizer': 'Adam'}. Best is trial 290 with value: 0.7166826096177101.
Trial 787 finished with value: 0.7385486704111099 and parameters: {'lr': 0.0006703665933864706, 'batch_size': 157, 'n_epochs': 2987, 'early_stop': 377, 'n_neurons': 52, 'optimizer': 'Adam'}. Best is trial 290 with value: 0.7166826096177101.
Trial 788 finished with value: 0.7265385448932647 and parameters: {'lr': 0.0006081506755013525, 'batch_size': 173, 'n_epochs': 3382, 'early_stop': 357, 'n_neurons': 50, 'optimizer': 'Adam'}. Best is trial 290 with value: 0.7166826096177101.
Trial 789 finished with value: 0.7369415149092674 and parameters: {'lr': 0.000563624648451048, 'batch_size': 177, 'n_epochs': 3758, 'early_stop': 338, 'n_neurons': 55, 'optimizer': 'Adam'}. Best is trial 290 with value: 0.7166826096177101.
Trial 790 finished with value: 0.7519454026222229 and parameters: {'lr': 0.000594430856532406, 'batch_size': 168, 'n_epochs': 3423, 'early_stop': 317, 'n_neurons': 52, 'optimizer': 'Adam'}. Best is trial 290 with value: 0.7166826096177101.
Trial 791 finished with value: 0.7537424913048745 and parameters: {'lr': 0.0005065563992374987, 'batch_size': 171, 'n_epochs': 3310, 'early_stop': 352, 'n_neurons': 50, 'optimizer': 'Adam'}. Best is trial 290 with value: 0.7166826096177101.
Trial 792 finished with value: 0.7496312570571899 and parameters: {'lr': 0.0006170891714047975, 'batch_size': 179, 'n_epochs': 3398, 'early_stop': 332, 'n_neurons': 53, 'optimizer': 'Adam'}. Best is trial 290 with value: 0.7166826096177101.
Trial 793 finished with value: 0.7350040256977082 and parameters: {'lr': 0.000536975608901844, 'batch_size': 173, 'n_epochs': 3109, 'early_stop': 308, 'n_neurons': 51, 'optimizer': 'Adam'}. Best is trial 290 with value: 0.7166826096177101.
Trial 794 finished with value: 4.9085609817504885 and parameters: {'lr': 5.2972518233919076e-05, 'batch_size': 162, 'n_epochs': 3161, 'early_stop': 343, 'n_neurons': 113, 'optimizer': 'Adam'}. Best is trial 290 with value: 0.7166826096177101.
Trial 795 finished with value: 0.7931355768442154 and parameters: {'lr': 0.0006105662610775506, 'batch_size': 163, 'n_epochs': 3585, 'early_stop': 296, 'n_neurons': 55, 'optimizer': 'Adam'}. Best is trial 290 with value: 0.7166826096177101.
Trial 796 finished with value: 0.7604347288608551 and parameters: {'lr': 0.0006657389172189725, 'batch_size': 180, 'n_epochs': 3231, 'early_stop': 319, 'n_neurons': 120, 'optimizer': 'Adam'}. Best is trial 290 with value: 0.7166826096177101.
Trial 797 finished with value: 0.7541000866889953 and parameters: {'lr': 0.00046820041350967956, 'batch_size': 152, 'n_epochs': 2897, 'early_stop': 358, 'n_neurons': 142, 'optimizer': 'Adam'}. Best is trial 290 with value: 0.7166826096177101.
Trial 798 finished with value: 0.7468619155883789 and parameters: {'lr': 0.0005707760106559944, 'batch_size': 188, 'n_epochs': 3910, 'early_stop': 330, 'n_neurons': 53, 'optimizer': 'Adam'}. Best is trial 290 with value: 0.7166826096177101.
Trial 799 finished with value: 0.7423425409197807 and parameters: {'lr': 0.0006688430484767878, 'batch_size': 169, 'n_epochs': 3729, 'early_stop': 303, 'n_neurons': 51, 'optimizer': 'Adam'}. Best is trial 290 with value: 0.7166826096177101.
Trial 800 finished with value: 0.8860432958602905 and parameters: {'lr': 0.0006234818007095325, 'batch_size': 176, 'n_epochs': 3500, 'early_stop': 312, 'n_neurons': 50, 'optimizer': 'SGD'}. Best is trial 290 with value: 0.7166826096177101.
Trial 801 finished with value: 0.7421620416641236 and parameters: {'lr': 0.000534644989258239, 'batch_size': 184, 'n_epochs': 3234, 'early_stop': 288, 'n_neurons': 56, 'optimizer': 'Adam'}. Best is trial 290 with value: 0.7166826096177101.
Trial 802 finished with value: 0.7300922334194183 and parameters: {'lr': 0.00045150565001556356, 'batch_size': 159, 'n_epochs': 3427, 'early_stop': 325, 'n_neurons': 53, 'optimizer': 'Adam'}. Best is trial 290 with value: 0.7166826096177101.
Trial 803 finished with value: 0.7881150245666504 and parameters: {'lr': 0.0007094270449605815, 'batch_size': 206, 'n_epochs': 2829, 'early_stop': 500, 'n_neurons': 249, 'optimizer': 'Adam'}. Best is trial 290 with value: 0.7166826096177101.
Trial 804 finished with value: 0.7471189725399018 and parameters: {'lr': 0.000612187564761762, 'batch_size': 34, 'n_epochs': 5974, 'early_stop': 347, 'n_neurons': 50, 'optimizer': 'Adam'}. Best is trial 290 with value: 0.7166826096177101.
Trial 805 finished with value: 0.748650586605072 and parameters: {'lr': 0.0005098069342154102, 'batch_size': 165, 'n_epochs': 3545, 'early_stop': 338, 'n_neurons': 52, 'optimizer': 'Adam'}. Best is trial 290 with value: 0.7166826096177101.
Trial 806 finished with value: 0.734795576930046 and parameters: {'lr': 0.0007365675563001928, 'batch_size': 191, 'n_epochs': 2339, 'early_stop': 280, 'n_neurons': 54, 'optimizer': 'Adam'}. Best is trial 290 with value: 0.7166826096177101.
Trial 807 finished with value: 0.7479471692442894 and parameters: {'lr': 0.0006699021333038685, 'batch_size': 151, 'n_epochs': 2777, 'early_stop': 308, 'n_neurons': 52, 'optimizer': 'Adam'}. Best is trial 290 with value: 0.7166826096177101.
Trial 808 finished with value: 0.7367633885145187 and parameters: {'lr': 0.00041211102766654874, 'batch_size': 174, 'n_epochs': 3070, 'early_stop': 318, 'n_neurons': 50, 'optimizer': 'Adam'}. Best is trial 290 with value: 0.7166826096177101.
Trial 809 finished with value: 0.7677627837657929 and parameters: {'lr': 0.0005735945329252066, 'batch_size': 46, 'n_epochs': 3347, 'early_stop': 183, 'n_neurons': 56, 'optimizer': 'Adam'}. Best is trial 290 with value: 0.7166826096177101.
Trial 810 finished with value: 0.7423672956228257 and parameters: {'lr': 0.0007158375113460182, 'batch_size': 197, 'n_epochs': 2639, 'early_stop': 294, 'n_neurons': 52, 'optimizer': 'Adam'}. Best is trial 290 with value: 0.7166826096177101.
Trial 811 finished with value: 0.74345867395401 and parameters: {'lr': 0.000657320727956341, 'batch_size': 184, 'n_epochs': 2547, 'early_stop': 328, 'n_neurons': 54, 'optimizer': 'Adam'}. Best is trial 290 with value: 0.7166826096177101.
Trial 812 finished with value: 0.7419399547576905 and parameters: {'lr': 0.00037404162545718445, 'batch_size': 146, 'n_epochs': 2966, 'early_stop': 354, 'n_neurons': 50, 'optimizer': 'Adam'}. Best is trial 290 with value: 0.7166826096177101.
Trial 813 finished with value: 0.7371552348136902 and parameters: {'lr': 0.0005583338462009697, 'batch_size': 80, 'n_epochs': 3911, 'early_stop': 305, 'n_neurons': 52, 'optimizer': 'Adam'}. Best is trial 290 with value: 0.7166826096177101.
Trial 814 finished with value: 0.7383872884511947 and parameters: {'lr': 0.0007404810176120304, 'batch_size': 74, 'n_epochs': 3667, 'early_stop': 318, 'n_neurons': 55, 'optimizer': 'Adam'}. Best is trial 290 with value: 0.7166826096177101.
Trial 815 finished with value: 0.7341396450996399 and parameters: {'lr': 0.0006149180992709653, 'batch_size': 167, 'n_epochs': 1821, 'early_stop': 334, 'n_neurons': 50, 'optimizer': 'Adam'}. Best is trial 290 with value: 0.7166826096177101.
Trial 816 finished with value: 0.7436366260051728 and parameters: {'lr': 0.0007569517981813453, 'batch_size': 155, 'n_epochs': 2502, 'early_stop': 301, 'n_neurons': 53, 'optimizer': 'Adam'}. Best is trial 290 with value: 0.7166826096177101.
Trial 817 finished with value: 0.7327414819598198 and parameters: {'lr': 0.0005103455995240195, 'batch_size': 139, 'n_epochs': 2769, 'early_stop': 322, 'n_neurons': 52, 'optimizer': 'Adam'}. Best is trial 290 with value: 0.7166826096177101.
Trial 818 finished with value: 0.7464471256732941 and parameters: {'lr': 0.0006795244696503593, 'batch_size': 182, 'n_epochs': 2667, 'early_stop': 339, 'n_neurons': 57, 'optimizer': 'Adam'}. Best is trial 290 with value: 0.7166826096177101.
Trial 819 finished with value: 0.7386574134230613 and parameters: {'lr': 0.0006018314478191161, 'batch_size': 173, 'n_epochs': 4176, 'early_stop': 285, 'n_neurons': 54, 'optimizer': 'Adam'}. Best is trial 290 with value: 0.7166826096177101.
