Trial 182 finished with value: 0.7400977700948715 and parameters: {'lr': 0.00028669040699127915, 'batch_size': 85, 'n_epochs': 2199, 'early_stop': 390, 'n_neurons': 53, 'optimizer': 'Adam'}. Best is trial 78 with value: 0.7250673314929008.
Trial 183 finished with value: 0.749937444627285 and parameters: {'lr': 0.0003931387663419376, 'batch_size': 91, 'n_epochs': 2314, 'early_stop': 361, 'n_neurons': 50, 'optimizer': 'Adam'}. Best is trial 78 with value: 0.7250673314929008.
Trial 184 finished with value: 0.7409462830424309 and parameters: {'lr': 0.00043405495664673797, 'batch_size': 77, 'n_epochs': 1844, 'early_stop': 303, 'n_neurons': 55, 'optimizer': 'Adam'}. Best is trial 78 with value: 0.7250673314929008.
Trial 185 finished with value: 0.742766834795475 and parameters: {'lr': 0.00048738415687580303, 'batch_size': 81, 'n_epochs': 2031, 'early_stop': 373, 'n_neurons': 58, 'optimizer': 'Adam'}. Best is trial 78 with value: 0.7250673314929008.
Trial 186 finished with value: 0.801958035826683 and parameters: {'lr': 0.00012182653822831682, 'batch_size': 66, 'n_epochs': 2121, 'early_stop': 334, 'n_neurons': 65, 'optimizer': 'Adam'}. Best is trial 78 with value: 0.7250673314929008.
Trial 187 finished with value: 0.7371539324522018 and parameters: {'lr': 0.000540247561631085, 'batch_size': 75, 'n_epochs': 1908, 'early_stop': 415, 'n_neurons': 56, 'optimizer': 'Adam'}. Best is trial 78 with value: 0.7250673314929008.
Trial 188 finished with value: 0.7400827705860138 and parameters: {'lr': 0.0003051513971135468, 'batch_size': 100, 'n_epochs': 2230, 'early_stop': 399, 'n_neurons': 51, 'optimizer': 'Adam'}. Best is trial 78 with value: 0.7250673314929008.
Trial 189 finished with value: 0.778710515499115 and parameters: {'lr': 0.00036235231002791694, 'batch_size': 88, 'n_epochs': 1995, 'early_stop': 349, 'n_neurons': 174, 'optimizer': 'Adam'}. Best is trial 78 with value: 0.7250673314929008.
Trial 190 finished with value: 0.7358961194753647 and parameters: {'lr': 0.0004238522969735997, 'batch_size': 83, 'n_epochs': 2521, 'early_stop': 325, 'n_neurons': 53, 'optimizer': 'Adam'}. Best is trial 78 with value: 0.7250673314929008.
Trial 191 finished with value: 0.7300089359283447 and parameters: {'lr': 0.0004142809253587808, 'batch_size': 80, 'n_epochs': 2571, 'early_stop': 299, 'n_neurons': 53, 'optimizer': 'Adam'}. Best is trial 78 with value: 0.7250673314929008.
Trial 192 finished with value: 0.7300686526298523 and parameters: {'lr': 0.00041404769692557786, 'batch_size': 84, 'n_epochs': 2569, 'early_stop': 308, 'n_neurons': 53, 'optimizer': 'Adam'}. Best is trial 78 with value: 0.7250673314929008.
Trial 193 finished with value: 0.7494561856985092 and parameters: {'lr': 0.000335460764234639, 'batch_size': 94, 'n_epochs': 2429, 'early_stop': 279, 'n_neurons': 53, 'optimizer': 'Adam'}. Best is trial 78 with value: 0.7250673314929008.
Trial 194 finished with value: 0.7492194044589996 and parameters: {'lr': 0.0004035887907917076, 'batch_size': 78, 'n_epochs': 2681, 'early_stop': 309, 'n_neurons': 51, 'optimizer': 'Adam'}. Best is trial 78 with value: 0.7250673314929008.
Trial 195 finished with value: 0.7373454505205155 and parameters: {'lr': 0.000493780309597453, 'batch_size': 71, 'n_epochs': 2571, 'early_stop': 291, 'n_neurons': 55, 'optimizer': 'Adam'}. Best is trial 78 with value: 0.7250673314929008.
Trial 196 finished with value: 0.7470460295677185 and parameters: {'lr': 0.00035981157910790575, 'batch_size': 86, 'n_epochs': 2419, 'early_stop': 304, 'n_neurons': 56, 'optimizer': 'Adam'}. Best is trial 78 with value: 0.7250673314929008.
Trial 197 finished with value: 0.7386043965816498 and parameters: {'lr': 0.00040753686675260356, 'batch_size': 75, 'n_epochs': 2573, 'early_stop': 333, 'n_neurons': 58, 'optimizer': 'Adam'}. Best is trial 78 with value: 0.7250673314929008.
Trial 198 finished with value: 0.7319341441988945 and parameters: {'lr': 0.0005757084774242302, 'batch_size': 89, 'n_epochs': 2324, 'early_stop': 295, 'n_neurons': 53, 'optimizer': 'Adam'}. Best is trial 78 with value: 0.7250673314929008.
Trial 199 finished with value: 0.7569821119308472 and parameters: {'lr': 0.0007605222163842576, 'batch_size': 80, 'n_epochs': 2359, 'early_stop': 294, 'n_neurons': 208, 'optimizer': 'Adam'}. Best is trial 78 with value: 0.7250673314929008.
Trial 200 finished with value: 0.7305654641985894 and parameters: {'lr': 0.0005737293149844677, 'batch_size': 99, 'n_epochs': 2266, 'early_stop': 268, 'n_neurons': 53, 'optimizer': 'Adam'}. Best is trial 78 with value: 0.7250673314929008.
Trial 201 finished with value: 0.7372784292697907 and parameters: {'lr': 0.0005763424005911365, 'batch_size': 98, 'n_epochs': 2234, 'early_stop': 284, 'n_neurons': 53, 'optimizer': 'Adam'}. Best is trial 78 with value: 0.7250673314929008.
Trial 202 finished with value: 0.738277283012867 and parameters: {'lr': 0.0006249752731105368, 'batch_size': 103, 'n_epochs': 2300, 'early_stop': 296, 'n_neurons': 51, 'optimizer': 'Adam'}. Best is trial 78 with value: 0.7250673314929008.
Trial 203 finished with value: 0.7345875081419945 and parameters: {'lr': 0.000673725425348387, 'batch_size': 93, 'n_epochs': 2075, 'early_stop': 267, 'n_neurons': 54, 'optimizer': 'Adam'}. Best is trial 78 with value: 0.7250673314929008.
Trial 204 finished with value: 0.7446640253067016 and parameters: {'lr': 0.0008279785869335397, 'batch_size': 93, 'n_epochs': 2108, 'early_stop': 268, 'n_neurons': 54, 'optimizer': 'Adam'}. Best is trial 78 with value: 0.7250673314929008.
Trial 205 finished with value: 0.7272739088535309 and parameters: {'lr': 0.0006665892842587533, 'batch_size': 172, 'n_epochs': 2054, 'early_stop': 254, 'n_neurons': 50, 'optimizer': 'Adam'}. Best is trial 78 with value: 0.7250673314929008.
Trial 206 finished with value: 0.7364747196435928 and parameters: {'lr': 0.0006620972332364365, 'batch_size': 60, 'n_epochs': 2064, 'early_stop': 282, 'n_neurons': 51, 'optimizer': 'Adam'}. Best is trial 78 with value: 0.7250673314929008.
Trial 207 finished with value: 0.7518506410717964 and parameters: {'lr': 0.0007742878797485697, 'batch_size': 183, 'n_epochs': 2021, 'early_stop': 246, 'n_neurons': 50, 'optimizer': 'Adam'}. Best is trial 78 with value: 0.7250673314929008.
Trial 208 finished with value: 0.7440040880441665 and parameters: {'lr': 0.0006904640570482871, 'batch_size': 83, 'n_epochs': 2297, 'early_stop': 255, 'n_neurons': 53, 'optimizer': 'Adam'}. Best is trial 78 with value: 0.7250673314929008.
Trial 209 finished with value: 0.7388149291276932 and parameters: {'lr': 0.0005708340936467488, 'batch_size': 90, 'n_epochs': 2154, 'early_stop': 267, 'n_neurons': 55, 'optimizer': 'Adam'}. Best is trial 78 with value: 0.7250673314929008.
Trial 210 finished with value: 0.7578439301252365 and parameters: {'lr': 0.0006852604396188639, 'batch_size': 163, 'n_epochs': 2610, 'early_stop': 317, 'n_neurons': 52, 'optimizer': 'Adam'}. Best is trial 78 with value: 0.7250673314929008.
Trial 211 finished with value: 0.7435230323672295 and parameters: {'lr': 0.0006211522177946397, 'batch_size': 79, 'n_epochs': 2192, 'early_stop': 269, 'n_neurons': 57, 'optimizer': 'Adam'}. Best is trial 78 with value: 0.7250673314929008.
Trial 212 finished with value: 0.7403751209378242 and parameters: {'lr': 0.0005486473460435738, 'batch_size': 153, 'n_epochs': 2355, 'early_stop': 259, 'n_neurons': 50, 'optimizer': 'Adam'}. Best is trial 78 with value: 0.7250673314929008.
Trial 213 finished with value: 0.7363054379820824 and parameters: {'lr': 0.0005229953458035111, 'batch_size': 85, 'n_epochs': 2092, 'early_stop': 247, 'n_neurons': 55, 'optimizer': 'Adam'}. Best is trial 78 with value: 0.7250673314929008.
Trial 214 finished with value: 0.7311484664678574 and parameters: {'lr': 0.0007413782775491508, 'batch_size': 90, 'n_epochs': 2264, 'early_stop': 237, 'n_neurons': 53, 'optimizer': 'Adam'}. Best is trial 78 with value: 0.7250673314929008.
Trial 215 finished with value: 0.7383862674236298 and parameters: {'lr': 0.0008810682520772181, 'batch_size': 95, 'n_epochs': 2477, 'early_stop': 257, 'n_neurons': 52, 'optimizer': 'Adam'}. Best is trial 78 with value: 0.7250673314929008.
Trial 216 finished with value: 0.7471584224700928 and parameters: {'lr': 0.0006899401220984697, 'batch_size': 56, 'n_epochs': 2289, 'early_stop': 241, 'n_neurons': 54, 'optimizer': 'Adam'}. Best is trial 78 with value: 0.7250673314929008.
Trial 217 finished with value: 0.8379037395119667 and parameters: {'lr': 0.0007406162320794823, 'batch_size': 63, 'n_epochs': 1964, 'early_stop': 278, 'n_neurons': 53, 'optimizer': 'SGD'}. Best is trial 78 with value: 0.7250673314929008.
Trial 218 finished with value: 6.608479022979736 and parameters: {'lr': 0.00014107111788475054, 'batch_size': 255, 'n_epochs': 2832, 'early_stop': 238, 'n_neurons': 50, 'optimizer': 'Adam'}. Best is trial 78 with value: 0.7250673314929008.
Trial 219 finished with value: 0.7319111359119416 and parameters: {'lr': 0.0006124417944162262, 'batch_size': 76, 'n_epochs': 2239, 'early_stop': 252, 'n_neurons': 56, 'optimizer': 'Adam'}. Best is trial 78 with value: 0.7250673314929008.
Trial 220 finished with value: 0.7722300812602043 and parameters: {'lr': 0.00017813870694904436, 'batch_size': 75, 'n_epochs': 2237, 'early_stop': 133, 'n_neurons': 114, 'optimizer': 'Adam'}. Best is trial 78 with value: 0.7250673314929008.
Trial 221 finished with value: 0.7440279912948609 and parameters: {'lr': 0.0006150567882815447, 'batch_size': 72, 'n_epochs': 2063, 'early_stop': 249, 'n_neurons': 56, 'optimizer': 'Adam'}. Best is trial 78 with value: 0.7250673314929008.
Trial 222 finished with value: 0.7363450887799263 and parameters: {'lr': 0.0006392984480805819, 'batch_size': 171, 'n_epochs': 2158, 'early_stop': 260, 'n_neurons': 58, 'optimizer': 'Adam'}. Best is trial 78 with value: 0.7250673314929008.
Trial 223 finished with value: 0.7353541439771653 and parameters: {'lr': 0.0007645123134244291, 'batch_size': 77, 'n_epochs': 2350, 'early_stop': 234, 'n_neurons': 54, 'optimizer': 'Adam'}. Best is trial 78 with value: 0.7250673314929008.
Trial 224 finished with value: 0.7506320476531982 and parameters: {'lr': 0.000585118500632398, 'batch_size': 232, 'n_epochs': 2267, 'early_stop': 360, 'n_neurons': 52, 'optimizer': 'Adam'}. Best is trial 78 with value: 0.7250673314929008.
Trial 225 finished with value: 0.7309921234846115 and parameters: {'lr': 0.0006963773338889332, 'batch_size': 81, 'n_epochs': 2018, 'early_stop': 289, 'n_neurons': 56, 'optimizer': 'Adam'}. Best is trial 78 with value: 0.7250673314929008.
Trial 226 finished with value: 0.742874264717102 and parameters: {'lr': 0.00030966752950914667, 'batch_size': 80, 'n_epochs': 1985, 'early_stop': 142, 'n_neurons': 56, 'optimizer': 'Adam'}. Best is trial 78 with value: 0.7250673314929008.
Trial 227 finished with value: 0.7397010308504105 and parameters: {'lr': 0.0007136791852052611, 'batch_size': 83, 'n_epochs': 2402, 'early_stop': 309, 'n_neurons': 59, 'optimizer': 'Adam'}. Best is trial 78 with value: 0.7250673314929008.
Trial 228 finished with value: 0.7476240628957749 and parameters: {'lr': 0.0005587259743906176, 'batch_size': 78, 'n_epochs': 1877, 'early_stop': 287, 'n_neurons': 57, 'optimizer': 'Adam'}. Best is trial 78 with value: 0.7250673314929008.
Trial 229 finished with value: 0.7355473041534424 and parameters: {'lr': 0.0002055747942530759, 'batch_size': 205, 'n_epochs': 2159, 'early_stop': 275, 'n_neurons': 52, 'optimizer': 'Adam'}. Best is trial 78 with value: 0.7250673314929008.
Trial 230 finished with value: 1.8435290122032166 and parameters: {'lr': 4.644845842912805e-05, 'batch_size': 68, 'n_epochs': 2669, 'early_stop': 299, 'n_neurons': 56, 'optimizer': 'Adam'}. Best is trial 78 with value: 0.7250673314929008.
Trial 231 finished with value: 0.731928414106369 and parameters: {'lr': 0.0008053147160341918, 'batch_size': 90, 'n_epochs': 2027, 'early_stop': 292, 'n_neurons': 54, 'optimizer': 'Adam'}. Best is trial 78 with value: 0.7250673314929008.
Trial 232 finished with value: 0.7471933460235596 and parameters: {'lr': 0.0007447930878771734, 'batch_size': 84, 'n_epochs': 1992, 'early_stop': 292, 'n_neurons': 54, 'optimizer': 'Adam'}. Best is trial 78 with value: 0.7250673314929008.
Trial 233 finished with value: 0.7327393788099289 and parameters: {'lr': 0.0008412092360166034, 'batch_size': 74, 'n_epochs': 2057, 'early_stop': 304, 'n_neurons': 50, 'optimizer': 'Adam'}. Best is trial 78 with value: 0.7250673314929008.
Trial 234 finished with value: 0.7291782176494599 and parameters: {'lr': 0.0008406912552390748, 'batch_size': 74, 'n_epochs': 2209, 'early_stop': 295, 'n_neurons': 51, 'optimizer': 'Adam'}. Best is trial 78 with value: 0.7250673314929008.
Trial 235 finished with value: 0.7388770890235901 and parameters: {'lr': 0.0008689318022830383, 'batch_size': 72, 'n_epochs': 2209, 'early_stop': 298, 'n_neurons': 52, 'optimizer': 'Adam'}. Best is trial 78 with value: 0.7250673314929008.
Trial 236 finished with value: 0.7387300133705139 and parameters: {'lr': 0.0008231989109156436, 'batch_size': 75, 'n_epochs': 2482, 'early_stop': 287, 'n_neurons': 52, 'optimizer': 'Adam'}. Best is trial 78 with value: 0.7250673314929008.
Trial 237 finished with value: 0.7393458038568497 and parameters: {'lr': 0.0009002296961989003, 'batch_size': 70, 'n_epochs': 2271, 'early_stop': 308, 'n_neurons': 55, 'optimizer': 'Adam'}. Best is trial 78 with value: 0.7250673314929008.
Trial 238 finished with value: 0.7290934574604034 and parameters: {'lr': 0.0007105557263225595, 'batch_size': 81, 'n_epochs': 2155, 'early_stop': 281, 'n_neurons': 50, 'optimizer': 'Adam'}. Best is trial 78 with value: 0.7250673314929008.
Trial 239 finished with value: 0.7263370990753174 and parameters: {'lr': 0.000793567786851262, 'batch_size': 88, 'n_epochs': 2047, 'early_stop': 277, 'n_neurons': 50, 'optimizer': 'Adam'}. Best is trial 78 with value: 0.7250673314929008.
Trial 240 finished with value: 0.7380884373188019 and parameters: {'lr': 0.0008213095641711536, 'batch_size': 89, 'n_epochs': 2050, 'early_stop': 276, 'n_neurons': 50, 'optimizer': 'Adam'}. Best is trial 78 with value: 0.7250673314929008.
Trial 241 finished with value: 0.7342139047384262 and parameters: {'lr': 0.0009003579438389216, 'batch_size': 82, 'n_epochs': 2143, 'early_stop': 288, 'n_neurons': 50, 'optimizer': 'Adam'}. Best is trial 78 with value: 0.7250673314929008.
Trial 242 finished with value: 0.7287326991558075 and parameters: {'lr': 0.0009766757964925212, 'batch_size': 85, 'n_epochs': 2042, 'early_stop': 282, 'n_neurons': 53, 'optimizer': 'Adam'}. Best is trial 78 with value: 0.7250673314929008.
Trial 243 finished with value: 0.7390448355674744 and parameters: {'lr': 0.0009624826810295396, 'batch_size': 88, 'n_epochs': 2058, 'early_stop': 281, 'n_neurons': 52, 'optimizer': 'Adam'}. Best is trial 78 with value: 0.7250673314929008.
Trial 244 finished with value: 0.7418966102600097 and parameters: {'lr': 0.0007826807282439655, 'batch_size': 87, 'n_epochs': 1918, 'early_stop': 299, 'n_neurons': 53, 'optimizer': 'Adam'}. Best is trial 78 with value: 0.7250673314929008.
Trial 245 finished with value: 0.7383938655257225 and parameters: {'lr': 0.0008144485268760125, 'batch_size': 75, 'n_epochs': 1988, 'early_stop': 270, 'n_neurons': 51, 'optimizer': 'Adam'}. Best is trial 78 with value: 0.7250673314929008.
Trial 246 finished with value: 0.7293779247999191 and parameters: {'lr': 0.0009385143861786809, 'batch_size': 86, 'n_epochs': 1796, 'early_stop': 286, 'n_neurons': 54, 'optimizer': 'Adam'}. Best is trial 78 with value: 0.7250673314929008.
Trial 247 finished with value: 0.7421327948570251 and parameters: {'lr': 0.000911505590945979, 'batch_size': 90, 'n_epochs': 1786, 'early_stop': 284, 'n_neurons': 54, 'optimizer': 'Adam'}. Best is trial 78 with value: 0.7250673314929008.
Trial 248 finished with value: 0.7367215538024903 and parameters: {'lr': 0.0009042834965291657, 'batch_size': 84, 'n_epochs': 1820, 'early_stop': 294, 'n_neurons': 54, 'optimizer': 'Adam'}. Best is trial 78 with value: 0.7250673314929008.
Trial 249 finished with value: 0.7298913300037384 and parameters: {'lr': 0.000998975386187228, 'batch_size': 86, 'n_epochs': 1884, 'early_stop': 277, 'n_neurons': 52, 'optimizer': 'Adam'}. Best is trial 78 with value: 0.7250673314929008.
Trial 250 finished with value: 0.7378085136413575 and parameters: {'lr': 0.0007530527032921596, 'batch_size': 80, 'n_epochs': 1765, 'early_stop': 278, 'n_neurons': 55, 'optimizer': 'Adam'}. Best is trial 78 with value: 0.7250673314929008.
Trial 251 finished with value: 0.8560932040214538 and parameters: {'lr': 0.000996086447453743, 'batch_size': 85, 'n_epochs': 1720, 'early_stop': 272, 'n_neurons': 53, 'optimizer': 'SGD'}. Best is trial 78 with value: 0.7250673314929008.
Trial 252 finished with value: 0.736579895913601 and parameters: {'lr': 0.0008744280737874666, 'batch_size': 93, 'n_epochs': 1889, 'early_stop': 288, 'n_neurons': 56, 'optimizer': 'Adam'}. Best is trial 78 with value: 0.7250673314929008.
Trial 253 finished with value: 0.7319877624511719 and parameters: {'lr': 0.0009230308928603224, 'batch_size': 144, 'n_epochs': 1837, 'early_stop': 261, 'n_neurons': 52, 'optimizer': 'Adam'}. Best is trial 78 with value: 0.7250673314929008.
Trial 254 finished with value: 0.7322489786148071 and parameters: {'lr': 0.0009942815469646644, 'batch_size': 82, 'n_epochs': 1927, 'early_stop': 280, 'n_neurons': 56, 'optimizer': 'Adam'}. Best is trial 78 with value: 0.7250673314929008.
Trial 255 finished with value: 0.7355055725574493 and parameters: {'lr': 0.0009713707860103966, 'batch_size': 97, 'n_epochs': 1960, 'early_stop': 293, 'n_neurons': 53, 'optimizer': 'Adam'}. Best is trial 78 with value: 0.7250673314929008.
Trial 256 finished with value: 0.7311295720934868 and parameters: {'lr': 0.0007499300348933058, 'batch_size': 91, 'n_epochs': 1658, 'early_stop': 272, 'n_neurons': 52, 'optimizer': 'Adam'}. Best is trial 78 with value: 0.7250673314929008.
Trial 257 finished with value: 0.7338063752651215 and parameters: {'lr': 0.0007858722284593203, 'batch_size': 79, 'n_epochs': 1672, 'early_stop': 265, 'n_neurons': 57, 'optimizer': 'Adam'}. Best is trial 78 with value: 0.7250673314929008.
Trial 258 finished with value: 0.7441395223140717 and parameters: {'lr': 0.0007317430630023893, 'batch_size': 86, 'n_epochs': 1766, 'early_stop': 255, 'n_neurons': 52, 'optimizer': 'Adam'}. Best is trial 78 with value: 0.7250673314929008.
Trial 259 finished with value: 0.7429146260023117 and parameters: {'lr': 0.0008289583101384027, 'batch_size': 91, 'n_epochs': 1848, 'early_stop': 278, 'n_neurons': 55, 'optimizer': 'Adam'}. Best is trial 78 with value: 0.7250673314929008.
Trial 260 finished with value: 0.7375459671020508 and parameters: {'lr': 0.00069743790220048, 'batch_size': 65, 'n_epochs': 2753, 'early_stop': 269, 'n_neurons': 51, 'optimizer': 'Adam'}. Best is trial 78 with value: 0.7250673314929008.
Trial 261 finished with value: 0.7421962070465088 and parameters: {'lr': 0.0008060483661696356, 'batch_size': 86, 'n_epochs': 2635, 'early_stop': 274, 'n_neurons': 54, 'optimizer': 'Adam'}. Best is trial 78 with value: 0.7250673314929008.
Trial 262 finished with value: 0.7403272753953933 and parameters: {'lr': 0.0007208705311196439, 'batch_size': 81, 'n_epochs': 1579, 'early_stop': 170, 'n_neurons': 58, 'optimizer': 'Adam'}. Best is trial 78 with value: 0.7250673314929008.
Trial 263 finished with value: 0.7364599436521531 and parameters: {'lr': 0.0009738491684209377, 'batch_size': 170, 'n_epochs': 1528, 'early_stop': 254, 'n_neurons': 52, 'optimizer': 'Adam'}. Best is trial 78 with value: 0.7250673314929008.
Trial 264 finished with value: 0.736342602968216 and parameters: {'lr': 0.0008909092871376841, 'batch_size': 76, 'n_epochs': 1673, 'early_stop': 284, 'n_neurons': 55, 'optimizer': 'Adam'}. Best is trial 78 with value: 0.7250673314929008.
Trial 265 finished with value: 0.7332511663436889 and parameters: {'lr': 0.0006501589342332767, 'batch_size': 96, 'n_epochs': 1386, 'early_stop': 263, 'n_neurons': 57, 'optimizer': 'Adam'}. Best is trial 78 with value: 0.7250673314929008.
Trial 266 finished with value: 0.7479780122637749 and parameters: {'lr': 0.0007886001430603451, 'batch_size': 83, 'n_epochs': 1482, 'early_stop': 288, 'n_neurons': 50, 'optimizer': 'Adam'}. Best is trial 78 with value: 0.7250673314929008.
Trial 267 finished with value: 0.7444130992889404 and parameters: {'lr': 0.0006931688104308118, 'batch_size': 92, 'n_epochs': 1926, 'early_stop': 314, 'n_neurons': 54, 'optimizer': 'Adam'}. Best is trial 78 with value: 0.7250673314929008.
Trial 268 finished with value: 0.7478990381956101 and parameters: {'lr': 0.0009922394427043432, 'batch_size': 181, 'n_epochs': 2531, 'early_stop': 385, 'n_neurons': 52, 'optimizer': 'Adam'}. Best is trial 78 with value: 0.7250673314929008.
Trial 269 finished with value: 1.0458231750130653 and parameters: {'lr': 8.593101077766586e-05, 'batch_size': 79, 'n_epochs': 1997, 'early_stop': 301, 'n_neurons': 56, 'optimizer': 'Adam'}. Best is trial 78 with value: 0.7250673314929008.
Trial 270 finished with value: 0.8602074176073075 and parameters: {'lr': 0.0008527751366880697, 'batch_size': 71, 'n_epochs': 1632, 'early_stop': 245, 'n_neurons': 140, 'optimizer': 'SGD'}. Best is trial 78 with value: 0.7250673314929008.
Trial 271 finished with value: 0.7389131405949593 and parameters: {'lr': 0.0007458133536008881, 'batch_size': 77, 'n_epochs': 2122, 'early_stop': 274, 'n_neurons': 54, 'optimizer': 'Adam'}. Best is trial 78 with value: 0.7250673314929008.
Trial 272 finished with value: 0.7296602490544319 and parameters: {'lr': 0.0008956843725342659, 'batch_size': 67, 'n_epochs': 1846, 'early_stop': 252, 'n_neurons': 51, 'optimizer': 'Adam'}. Best is trial 78 with value: 0.7250673314929008.
Trial 273 finished with value: 0.7424268108606339 and parameters: {'lr': 0.0009180952651022083, 'batch_size': 66, 'n_epochs': 1823, 'early_stop': 251, 'n_neurons': 51, 'optimizer': 'Adam'}. Best is trial 78 with value: 0.7250673314929008.
